{
  "schema_version": 1,
  "evidence_id": "EV-0015",
  "owning_item": "C000.10",
  "subject_revision": "bc0a489f6f982f64d90dd05a38109944879c2e26",
  "subject_artifacts": [
    {
      "path": "docs/governance/evidence-v1.schema.json",
      "mode": "100644",
      "sha256": "286ee468e5e4903e0115381edbdd39c458ccbf717d4bbfb23eb21d764b1884d5"
    },
    {
      "path": "docs/governance/tracker-evidence-dependency-contract.md",
      "mode": "100644",
      "sha256": "62ea7e5f62fda1fd81bb2b0ab252de89ba21c7b5dc6f97334994e6c49a0647d8"
    },
    {
      "path": "docs/governance/tracker-v1.schema.json",
      "mode": "100644",
      "sha256": "14b1abd6a1c237e7bb5cb2bad68a0d1185d331880f80cd4c455347bce76aa450"
    },
    {
      "path": "tools/platform/c000_artifacts.py",
      "mode": "100755",
      "sha256": "54b1d4edac59b67964350ebde7ba12f07b40a4eadd7b78ce62aeec5a091419ab"
    },
    {
      "path": "tools/platform/run",
      "mode": "100755",
      "sha256": "8ac6a65cfcd1be677cd47292d1e02325a3b45c035ec3bdbc2d0dc1545124e0d6"
    },
    {
      "path": "tools/tracker/validate.py",
      "mode": "100755",
      "sha256": "b66248102e7cf3202a27c06e1fcd564b67f6b8f95f93ac91325e820a8aceca94"
    }
  ],
  "command": [
    "tools/platform/run",
    "c000-artifacts"
  ],
  "environment": {
    "tree_state": "clean",
    "toolchains": {
      "python": "Python 3.12.3",
      "git": "git version 2.43.0"
    },
    "platform_row": "P-LINUX-X64",
    "target": "x86_64-unknown-linux-gnu",
    "host_os": "linux",
    "host_architecture": "x86_64",
    "execution": "native",
    "working_directory": ".",
    "cells": [],
    "backend": "B-RUST-DEFAULT",
    "features": []
  },
  "run_id": "c000-descendant-20260829-154017Z-0015",
  "cases": [
    {
      "id": "C000.10",
      "outcome": "pass",
      "expected": {
        "artifacts_present": true,
        "documents_parse": true,
        "semantic_contracts_current": true
      },
      "observed": {
        "artifact_count": 3,
        "issues": []
      },
      "skip_disposition": null
    }
  ],
  "started_at": "2026-08-29T15:40:17Z",
  "ended_at": "2026-08-29T15:40:17Z",
  "observed_exit_code": 0,
  "observed_status": "pass",
  "expected": {
    "selected_cases": [
      "C000.10"
    ],
    "outcome": "pass"
  },
  "observed": {
    "selected_cases": [
      "C000.10"
    ],
    "audit_outcome": "fail",
    "case_outcomes": {
      "C000.10": "pass"
    }
  },
  "stdout": {
    "path": "docs/governance/evidence/EV-0015.20260829-154017Z.stdout.txt",
    "sha256": "82a4aad5afecc8935a1230c6dc2a6fc8c4797fef8aaa77e8e4d779c2aabedc86"
  },
  "stderr": {
    "path": "docs/governance/evidence/EV-0015.20260829-154017Z.stderr.txt",
    "sha256": "e3b0c44298fc1c149afbf4c8996fb92427ae41e4649b934ca495991b7852b855"
  },
  "artifacts": [],
  "invalidation_edges": [
    {
      "kind": "schema",
      "path": "docs/governance/evidence-v1.schema.json",
      "mode": "100644",
      "sha256": "286ee468e5e4903e0115381edbdd39c458ccbf717d4bbfb23eb21d764b1884d5"
    },
    {
      "kind": "source",
      "path": "docs/governance/tracker-evidence-dependency-contract.md",
      "mode": "100644",
      "sha256": "62ea7e5f62fda1fd81bb2b0ab252de89ba21c7b5dc6f97334994e6c49a0647d8"
    },
    {
      "kind": "source",
      "path": "docs/governance/tracker-v1.schema.json",
      "mode": "100644",
      "sha256": "14b1abd6a1c237e7bb5cb2bad68a0d1185d331880f80cd4c455347bce76aa450"
    },
    {
      "kind": "generator",
      "path": "tools/platform/c000_artifacts.py",
      "mode": "100755",
      "sha256": "54b1d4edac59b67964350ebde7ba12f07b40a4eadd7b78ce62aeec5a091419ab"
    },
    {
      "kind": "generator",
      "path": "tools/platform/run",
      "mode": "100755",
      "sha256": "8ac6a65cfcd1be677cd47292d1e02325a3b45c035ec3bdbc2d0dc1545124e0d6"
    },
    {
      "kind": "source",
      "path": "tools/tracker/validate.py",
      "mode": "100755",
      "sha256": "b66248102e7cf3202a27c06e1fcd564b67f6b8f95f93ac91325e820a8aceca94"
    }
  ],
  "review_bindings": [],
  "retention_until": "2027-08-29",
  "supersedes": null
}
