{
  "schema_version": 1,
  "evidence_id": "EV-0003",
  "owning_item": "C000.14",
  "subject_revision": "cb662bdb0001e8498811b22f618f18a683d3f1cb",
  "subject_artifacts": [
    {
      "path": "docs/governance/evidence-v1.schema.json",
      "mode": "100644",
      "sha256": "286ee468e5e4903e0115381edbdd39c458ccbf717d4bbfb23eb21d764b1884d5"
    },
    {
      "path": "docs/oracles/fixtures/v1/mismatch-error.json",
      "mode": "100644",
      "sha256": "37a6a62bfbf7ba355637da04400f764707b7068dc0ac9a494a66522ee8193530"
    },
    {
      "path": "docs/oracles/fixtures/v1/mismatch-forbidden-normalization.json",
      "mode": "100644",
      "sha256": "4842e34f710e223d457649faf73d344d0b12cb7baf92bbf9cf88ece065b71f05"
    },
    {
      "path": "docs/oracles/fixtures/v1/mismatch-normalization-forbidden-class.json",
      "mode": "100644",
      "sha256": "4435daa383c4d7559a00a11aa79e5002a08e94948bd48a6a39974950c4c538b3"
    },
    {
      "path": "docs/oracles/fixtures/v1/mismatch-normalization-forbidden-pointer.json",
      "mode": "100644",
      "sha256": "ad1616d90a7f148200b40a079aca401724a40a0a3af0a86032a5da92c6907af3"
    },
    {
      "path": "docs/oracles/fixtures/v1/mismatch-output.json",
      "mode": "100644",
      "sha256": "accae08c09be4a36bb41886c61ebc7c37cf2255157bd9453e1d986d6f727e6a1"
    },
    {
      "path": "docs/oracles/fixtures/v1/mismatch-state.json",
      "mode": "100644",
      "sha256": "29f22f2038eb9b209a56ee2eeb860aceeb00ae615e697feb63f5ddeb118186b8"
    },
    {
      "path": "docs/oracles/fixtures/v1/negative.json",
      "mode": "100644",
      "sha256": "e626eebc2f25e6717715bade230fce8260ab0ca8fb1bd7670d45f74aaca9245b"
    },
    {
      "path": "docs/oracles/fixtures/v1/positive.json",
      "mode": "100644",
      "sha256": "aa32a0a57c7c17885a6aac20809d14f961be15fd2e350e0d42f0d4d431ce68d6"
    },
    {
      "path": "docs/oracles/schemas/oracle-fixture-v1.schema.json",
      "mode": "100644",
      "sha256": "9e1c053e18b3c35ef8aa65eb974fa6cd869f66e12538138953994c6326e0f482"
    },
    {
      "path": "docs/oracles/schemas/oracle-result-v1.schema.json",
      "mode": "100644",
      "sha256": "f21a19efff4fb8749bae8b8eb2773e169f67c34788aff95654e72277d24725a4"
    },
    {
      "path": "tools/platform/c000_unit.py",
      "mode": "100755",
      "sha256": "374088ae10b289a755842bb62efdee91c32593dae9757b08fb236abe81e34ad2"
    },
    {
      "path": "tools/reference-runner/runner.py",
      "mode": "100755",
      "sha256": "cff1909a30e6f84ee43b776536db4041e4766b78e1d08f3494eb2406472ef3db"
    }
  ],
  "command": [
    "python3",
    "tools/platform/c000_unit.py"
  ],
  "environment": {
    "tree_state": "clean",
    "toolchains": {
      "python": "Python 3.12.3",
      "git": "git version 2.43.0"
    },
    "platform_row": "P-LINUX-X64",
    "target": "x86_64-unknown-linux-gnu",
    "host_os": "linux",
    "host_architecture": "x86_64",
    "execution": "native",
    "working_directory": ".",
    "cells": [
      "unit"
    ],
    "backend": "B-RUST-DEFAULT",
    "features": []
  },
  "run_id": "c000-descendant-20260829-151429Z-0003",
  "cases": [
    {
      "id": "fixture-schema:mismatch-error",
      "outcome": "pass",
      "expected": {
        "outcome": "pass"
      },
      "observed": {
        "case": "fixture-schema:mismatch-error",
        "errors": [],
        "outcome": "pass"
      },
      "skip_disposition": null
    },
    {
      "id": "fixture-schema:mismatch-forbidden-normalization",
      "outcome": "pass",
      "expected": {
        "outcome": "pass"
      },
      "observed": {
        "case": "fixture-schema:mismatch-forbidden-normalization",
        "errors": [],
        "outcome": "pass"
      },
      "skip_disposition": null
    },
    {
      "id": "fixture-schema:mismatch-normalization-forbidden-class",
      "outcome": "pass",
      "expected": {
        "outcome": "pass"
      },
      "observed": {
        "case": "fixture-schema:mismatch-normalization-forbidden-class",
        "errors": [],
        "outcome": "pass"
      },
      "skip_disposition": null
    },
    {
      "id": "fixture-schema:mismatch-normalization-forbidden-pointer",
      "outcome": "pass",
      "expected": {
        "outcome": "pass"
      },
      "observed": {
        "case": "fixture-schema:mismatch-normalization-forbidden-pointer",
        "errors": [],
        "outcome": "pass"
      },
      "skip_disposition": null
    },
    {
      "id": "fixture-schema:mismatch-output",
      "outcome": "pass",
      "expected": {
        "outcome": "pass"
      },
      "observed": {
        "case": "fixture-schema:mismatch-output",
        "errors": [],
        "outcome": "pass"
      },
      "skip_disposition": null
    },
    {
      "id": "fixture-schema:mismatch-state",
      "outcome": "pass",
      "expected": {
        "outcome": "pass"
      },
      "observed": {
        "case": "fixture-schema:mismatch-state",
        "errors": [],
        "outcome": "pass"
      },
      "skip_disposition": null
    },
    {
      "id": "fixture-schema:negative",
      "outcome": "pass",
      "expected": {
        "outcome": "pass"
      },
      "observed": {
        "case": "fixture-schema:negative",
        "errors": [],
        "outcome": "pass"
      },
      "skip_disposition": null
    },
    {
      "id": "fixture-schema:positive",
      "outcome": "pass",
      "expected": {
        "outcome": "pass"
      },
      "observed": {
        "case": "fixture-schema:positive",
        "errors": [],
        "outcome": "pass"
      },
      "skip_disposition": null
    },
    {
      "id": "runner-identify:java",
      "outcome": "pass",
      "expected": {
        "outcome": "pass"
      },
      "observed": {
        "case": "runner-identify:java",
        "exit_code": 0,
        "outcome": "pass"
      },
      "skip_disposition": null
    },
    {
      "id": "runner-identify:rust",
      "outcome": "pass",
      "expected": {
        "outcome": "pass"
      },
      "observed": {
        "case": "runner-identify:rust",
        "exit_code": 0,
        "outcome": "pass"
      },
      "skip_disposition": null
    }
  ],
  "started_at": "2026-08-29T15:14:29Z",
  "ended_at": "2026-08-29T15:14:29Z",
  "observed_exit_code": 0,
  "observed_status": "pass",
  "expected": {
    "case_count": 10,
    "all_pass": true
  },
  "observed": {
    "case_count": 10,
    "all_pass": true
  },
  "stdout": {
    "path": "docs/governance/evidence/EV-0003.stdout.txt",
    "sha256": "3c662819ced125446d18645896e70534fa749041b4d428e637f811db0f9084a2"
  },
  "stderr": {
    "path": "docs/governance/evidence/EV-0003.stderr.txt",
    "sha256": "e3b0c44298fc1c149afbf4c8996fb92427ae41e4649b934ca495991b7852b855"
  },
  "artifacts": [],
  "invalidation_edges": [
    {
      "kind": "schema",
      "path": "docs/governance/evidence-v1.schema.json",
      "mode": "100644",
      "sha256": "286ee468e5e4903e0115381edbdd39c458ccbf717d4bbfb23eb21d764b1884d5"
    },
    {
      "kind": "source",
      "path": "docs/oracles/fixtures/v1/mismatch-error.json",
      "mode": "100644",
      "sha256": "37a6a62bfbf7ba355637da04400f764707b7068dc0ac9a494a66522ee8193530"
    },
    {
      "kind": "source",
      "path": "docs/oracles/fixtures/v1/mismatch-forbidden-normalization.json",
      "mode": "100644",
      "sha256": "4842e34f710e223d457649faf73d344d0b12cb7baf92bbf9cf88ece065b71f05"
    },
    {
      "kind": "source",
      "path": "docs/oracles/fixtures/v1/mismatch-normalization-forbidden-class.json",
      "mode": "100644",
      "sha256": "4435daa383c4d7559a00a11aa79e5002a08e94948bd48a6a39974950c4c538b3"
    },
    {
      "kind": "source",
      "path": "docs/oracles/fixtures/v1/mismatch-normalization-forbidden-pointer.json",
      "mode": "100644",
      "sha256": "ad1616d90a7f148200b40a079aca401724a40a0a3af0a86032a5da92c6907af3"
    },
    {
      "kind": "source",
      "path": "docs/oracles/fixtures/v1/mismatch-output.json",
      "mode": "100644",
      "sha256": "accae08c09be4a36bb41886c61ebc7c37cf2255157bd9453e1d986d6f727e6a1"
    },
    {
      "kind": "source",
      "path": "docs/oracles/fixtures/v1/mismatch-state.json",
      "mode": "100644",
      "sha256": "29f22f2038eb9b209a56ee2eeb860aceeb00ae615e697feb63f5ddeb118186b8"
    },
    {
      "kind": "source",
      "path": "docs/oracles/fixtures/v1/negative.json",
      "mode": "100644",
      "sha256": "e626eebc2f25e6717715bade230fce8260ab0ca8fb1bd7670d45f74aaca9245b"
    },
    {
      "kind": "source",
      "path": "docs/oracles/fixtures/v1/positive.json",
      "mode": "100644",
      "sha256": "aa32a0a57c7c17885a6aac20809d14f961be15fd2e350e0d42f0d4d431ce68d6"
    },
    {
      "kind": "source",
      "path": "docs/oracles/schemas/oracle-fixture-v1.schema.json",
      "mode": "100644",
      "sha256": "9e1c053e18b3c35ef8aa65eb974fa6cd869f66e12538138953994c6326e0f482"
    },
    {
      "kind": "source",
      "path": "docs/oracles/schemas/oracle-result-v1.schema.json",
      "mode": "100644",
      "sha256": "f21a19efff4fb8749bae8b8eb2773e169f67c34788aff95654e72277d24725a4"
    },
    {
      "kind": "source",
      "path": "tools/platform/c000_unit.py",
      "mode": "100755",
      "sha256": "374088ae10b289a755842bb62efdee91c32593dae9757b08fb236abe81e34ad2"
    },
    {
      "kind": "source",
      "path": "tools/reference-runner/runner.py",
      "mode": "100755",
      "sha256": "cff1909a30e6f84ee43b776536db4041e4766b78e1d08f3494eb2406472ef3db"
    }
  ],
  "review_bindings": [],
  "retention_until": "2027-08-29",
  "supersedes": null
}
