{
  "schema_version": 1,
  "evidence_id": "EV-0010",
  "owning_item": "C000.05",
  "subject_revision": "3e6b93bae4a7c12f590c9a63edf80a5c699d36ec",
  "subject_artifacts": [
    {
      "path": "docs/governance/evidence-v1.schema.json",
      "mode": "100644",
      "sha256": "286ee468e5e4903e0115381edbdd39c458ccbf717d4bbfb23eb21d764b1884d5"
    },
    {
      "path": "docs/oracles/fixtures/v1/mismatch-error.json",
      "mode": "100644",
      "sha256": "37a6a62bfbf7ba355637da04400f764707b7068dc0ac9a494a66522ee8193530"
    },
    {
      "path": "docs/oracles/fixtures/v1/mismatch-forbidden-normalization.json",
      "mode": "100644",
      "sha256": "4842e34f710e223d457649faf73d344d0b12cb7baf92bbf9cf88ece065b71f05"
    },
    {
      "path": "docs/oracles/fixtures/v1/mismatch-normalization-forbidden-class.json",
      "mode": "100644",
      "sha256": "4435daa383c4d7559a00a11aa79e5002a08e94948bd48a6a39974950c4c538b3"
    },
    {
      "path": "docs/oracles/fixtures/v1/mismatch-normalization-forbidden-pointer.json",
      "mode": "100644",
      "sha256": "ad1616d90a7f148200b40a079aca401724a40a0a3af0a86032a5da92c6907af3"
    },
    {
      "path": "docs/oracles/fixtures/v1/mismatch-output.json",
      "mode": "100644",
      "sha256": "accae08c09be4a36bb41886c61ebc7c37cf2255157bd9453e1d986d6f727e6a1"
    },
    {
      "path": "docs/oracles/fixtures/v1/mismatch-state.json",
      "mode": "100644",
      "sha256": "29f22f2038eb9b209a56ee2eeb860aceeb00ae615e697feb63f5ddeb118186b8"
    },
    {
      "path": "docs/oracles/fixtures/v1/negative.json",
      "mode": "100644",
      "sha256": "e626eebc2f25e6717715bade230fce8260ab0ca8fb1bd7670d45f74aaca9245b"
    },
    {
      "path": "docs/oracles/fixtures/v1/positive.json",
      "mode": "100644",
      "sha256": "aa32a0a57c7c17885a6aac20809d14f961be15fd2e350e0d42f0d4d431ce68d6"
    },
    {
      "path": "docs/oracles/runner-protocol.md",
      "mode": "100644",
      "sha256": "6cb0946533a9e65358130c17621562039ff07ced52eec02f1d2256f4b9b79f01"
    },
    {
      "path": "tools/platform/c000_artifacts.py",
      "mode": "100755",
      "sha256": "541b94f562a922164ae27eb9f2af82c444d6309652764a8bc1f7ac597aa87f1b"
    },
    {
      "path": "tools/platform/run",
      "mode": "100755",
      "sha256": "8ac6a65cfcd1be677cd47292d1e02325a3b45c035ec3bdbc2d0dc1545124e0d6"
    },
    {
      "path": "tools/reference-runner/java-runner",
      "mode": "100755",
      "sha256": "deed7ed1b637cb82dc380c9da5eb56611ee8b8e8d172a74e592ca336a6298906"
    },
    {
      "path": "tools/reference-runner/runner.py",
      "mode": "100755",
      "sha256": "e0df161581a901f975205dd4f503f61c875ee333b97928ac38c9e02a0c290560"
    },
    {
      "path": "tools/reference-runner/rust-runner",
      "mode": "100755",
      "sha256": "360ed657851ac05f7609da5fa6e0bf78a283086789b4f1eb71c487ab41a870b9"
    },
    {
      "path": "tools/tracker/validate.py",
      "mode": "100755",
      "sha256": "cafccf36643a7c725b945774cfd5a3a121860d825f541ff14d0a17b06b2c2b1e"
    }
  ],
  "command": [
    "tools/platform/run",
    "c000-artifacts"
  ],
  "environment": {
    "tree_state": "clean",
    "toolchains": {
      "python": "Python 3.12.3",
      "git": "git version 2.43.0"
    },
    "platform_row": "P-LINUX-X64",
    "target": "x86_64-unknown-linux-gnu",
    "host_os": "linux",
    "host_architecture": "x86_64",
    "execution": "native",
    "working_directory": ".",
    "cells": [],
    "backend": "B-RUST-DEFAULT",
    "features": []
  },
  "run_id": "c000-descendant-20260829-163706Z-3e6b93ba-0010",
  "cases": [
    {
      "expected": {
        "artifacts_present": true,
        "documents_parse": true,
        "semantic_contracts_current": true
      },
      "id": "C000.05",
      "observed": {
        "artifact_count": 12,
        "issues": []
      },
      "outcome": "pass",
      "skip_disposition": null
    }
  ],
  "started_at": "2026-08-29T16:37:18Z",
  "ended_at": "2026-08-29T16:37:22Z",
  "observed_exit_code": 1,
  "observed_status": "pass",
  "expected": {
    "selected_cases": [
      "C000.05"
    ],
    "outcome": "pass"
  },
  "observed": {
    "selected_cases": [
      "C000.05"
    ],
    "audit_outcome": "fail",
    "case_outcomes": {
      "C000.05": "pass"
    }
  },
  "stdout": {
    "path": "docs/governance/evidence/EV-0010.20260829-163706Z-3e6b93ba-0010.stdout.txt",
    "sha256": "11f2b82c084ef2ee906bd154936f264ddc99d1848d06c9d6ea3b2f16711e74a0"
  },
  "stderr": {
    "path": "docs/governance/evidence/EV-0010.20260829-163706Z-3e6b93ba-0010.stderr.txt",
    "sha256": "e3b0c44298fc1c149afbf4c8996fb92427ae41e4649b934ca495991b7852b855"
  },
  "artifacts": [],
  "invalidation_edges": [
    {
      "kind": "schema",
      "path": "docs/governance/evidence-v1.schema.json",
      "mode": "100644",
      "sha256": "286ee468e5e4903e0115381edbdd39c458ccbf717d4bbfb23eb21d764b1884d5"
    },
    {
      "kind": "source",
      "path": "docs/oracles/fixtures/v1/mismatch-error.json",
      "mode": "100644",
      "sha256": "37a6a62bfbf7ba355637da04400f764707b7068dc0ac9a494a66522ee8193530"
    },
    {
      "kind": "source",
      "path": "docs/oracles/fixtures/v1/mismatch-forbidden-normalization.json",
      "mode": "100644",
      "sha256": "4842e34f710e223d457649faf73d344d0b12cb7baf92bbf9cf88ece065b71f05"
    },
    {
      "kind": "source",
      "path": "docs/oracles/fixtures/v1/mismatch-normalization-forbidden-class.json",
      "mode": "100644",
      "sha256": "4435daa383c4d7559a00a11aa79e5002a08e94948bd48a6a39974950c4c538b3"
    },
    {
      "kind": "source",
      "path": "docs/oracles/fixtures/v1/mismatch-normalization-forbidden-pointer.json",
      "mode": "100644",
      "sha256": "ad1616d90a7f148200b40a079aca401724a40a0a3af0a86032a5da92c6907af3"
    },
    {
      "kind": "source",
      "path": "docs/oracles/fixtures/v1/mismatch-output.json",
      "mode": "100644",
      "sha256": "accae08c09be4a36bb41886c61ebc7c37cf2255157bd9453e1d986d6f727e6a1"
    },
    {
      "kind": "source",
      "path": "docs/oracles/fixtures/v1/mismatch-state.json",
      "mode": "100644",
      "sha256": "29f22f2038eb9b209a56ee2eeb860aceeb00ae615e697feb63f5ddeb118186b8"
    },
    {
      "kind": "source",
      "path": "docs/oracles/fixtures/v1/negative.json",
      "mode": "100644",
      "sha256": "e626eebc2f25e6717715bade230fce8260ab0ca8fb1bd7670d45f74aaca9245b"
    },
    {
      "kind": "source",
      "path": "docs/oracles/fixtures/v1/positive.json",
      "mode": "100644",
      "sha256": "aa32a0a57c7c17885a6aac20809d14f961be15fd2e350e0d42f0d4d431ce68d6"
    },
    {
      "kind": "source",
      "path": "docs/oracles/runner-protocol.md",
      "mode": "100644",
      "sha256": "6cb0946533a9e65358130c17621562039ff07ced52eec02f1d2256f4b9b79f01"
    },
    {
      "kind": "generator",
      "path": "tools/platform/c000_artifacts.py",
      "mode": "100755",
      "sha256": "541b94f562a922164ae27eb9f2af82c444d6309652764a8bc1f7ac597aa87f1b"
    },
    {
      "kind": "generator",
      "path": "tools/platform/run",
      "mode": "100755",
      "sha256": "8ac6a65cfcd1be677cd47292d1e02325a3b45c035ec3bdbc2d0dc1545124e0d6"
    },
    {
      "kind": "source",
      "path": "tools/reference-runner/java-runner",
      "mode": "100755",
      "sha256": "deed7ed1b637cb82dc380c9da5eb56611ee8b8e8d172a74e592ca336a6298906"
    },
    {
      "kind": "source",
      "path": "tools/reference-runner/runner.py",
      "mode": "100755",
      "sha256": "e0df161581a901f975205dd4f503f61c875ee333b97928ac38c9e02a0c290560"
    },
    {
      "kind": "source",
      "path": "tools/reference-runner/rust-runner",
      "mode": "100755",
      "sha256": "360ed657851ac05f7609da5fa6e0bf78a283086789b4f1eb71c487ab41a870b9"
    },
    {
      "kind": "source",
      "path": "tools/tracker/validate.py",
      "mode": "100755",
      "sha256": "cafccf36643a7c725b945774cfd5a3a121860d825f541ff14d0a17b06b2c2b1e"
    }
  ],
  "review_bindings": [],
  "retention_until": "2027-08-29",
  "supersedes": null
}
