{
  "schema_version": 1,
  "evidence_id": "EV-0018",
  "owning_item": "C000.15",
  "subject_revision": "6b5ed14e342db9ac9afc820315dfe2daf45b6b2a",
  "subject_artifacts": [
    {
      "path": "docs/governance/adoption-inventory-v1.schema.json",
      "mode": "100644",
      "sha256": "dede0d4e6f683498282250604d65b5c341fa9176a5fa4d2d3b4d21a32299d612"
    },
    {
      "path": "docs/governance/adoption-inventory.v1.json",
      "mode": "100644",
      "sha256": "05457aec87cd82d4cf705f0a5c5655dff31350b00844a30cfdd5cf8c76a954bc"
    },
    {
      "path": "docs/governance/dependency-decisions.v1.json",
      "mode": "100644",
      "sha256": "b304de100258081b349c3435deb9fe329a8200548f949203a700fbc5a010b63c"
    },
    {
      "path": "docs/governance/evidence-v1.schema.json",
      "mode": "100644",
      "sha256": "286ee468e5e4903e0115381edbdd39c458ccbf717d4bbfb23eb21d764b1884d5"
    },
    {
      "path": "rust-tron/Cargo.lock",
      "mode": "100644",
      "sha256": "c8bf1395110ba03bc8fcb0e0f2d89dfc87d9c3f47b75a085662e2cb068723db4"
    },
    {
      "path": "rust-tron/Cargo.toml",
      "mode": "100644",
      "sha256": "8691685741ed539c44def10375169ee0a94329677ae5c61e373540993b1491f6"
    },
    {
      "path": "tools/platform/c000_artifacts.py",
      "mode": "100755",
      "sha256": "e2c3d877c1c73f166befbe78cea8a6361339b3788f8e1af792c9c2a0af3cef21"
    },
    {
      "path": "tools/platform/run",
      "mode": "100755",
      "sha256": "8ac6a65cfcd1be677cd47292d1e02325a3b45c035ec3bdbc2d0dc1545124e0d6"
    },
    {
      "path": "tools/tracker/validate.py",
      "mode": "100755",
      "sha256": "4df090bc5dfb8c681047f6b22cf6860a30f3cca426731b23dc4915361c5375a1"
    }
  ],
  "command": [
    "tools/platform/run",
    "c000-artifacts"
  ],
  "environment": {
    "tree_state": "clean",
    "toolchains": {
      "python": "Python 3.12.3",
      "git": "git version 2.43.0"
    },
    "platform_row": "P-LINUX-X64",
    "target": "x86_64-unknown-linux-gnu",
    "host_os": "linux",
    "host_architecture": "x86_64",
    "execution": "native",
    "working_directory": ".",
    "cells": [],
    "backend": "B-RUST-DEFAULT",
    "features": []
  },
  "run_id": "c000-descendant-20260829-161553Z-6b5ed14e-0018",
  "cases": [
    {
      "expected": {
        "artifacts_present": true,
        "documents_parse": true,
        "semantic_contracts_current": true
      },
      "id": "C000.15",
      "observed": {
        "artifact_count": 5,
        "issues": [
          "adoption inventory contains non-current instances"
        ]
      },
      "outcome": "fail",
      "skip_disposition": null
    }
  ],
  "started_at": "2026-08-29T16:15:40Z",
  "ended_at": "2026-08-29T16:15:43Z",
  "observed_exit_code": 1,
  "observed_status": "fail",
  "expected": {
    "selected_cases": [
      "C000.15"
    ],
    "outcome": "pass"
  },
  "observed": {
    "selected_cases": [
      "C000.15"
    ],
    "audit_outcome": "fail",
    "case_outcomes": {
      "C000.15": "fail"
    }
  },
  "stdout": {
    "path": "docs/governance/evidence/EV-0018.20260829-161553Z-6b5ed14e-0018.stdout.txt",
    "sha256": "6fb122c585d42d340dd884017f56f9b2095ec64c76693139a80f41357da325e4"
  },
  "stderr": {
    "path": "docs/governance/evidence/EV-0018.20260829-161553Z-6b5ed14e-0018.stderr.txt",
    "sha256": "e3b0c44298fc1c149afbf4c8996fb92427ae41e4649b934ca495991b7852b855"
  },
  "artifacts": [],
  "invalidation_edges": [
    {
      "kind": "source",
      "path": "docs/governance/adoption-inventory-v1.schema.json",
      "mode": "100644",
      "sha256": "dede0d4e6f683498282250604d65b5c341fa9176a5fa4d2d3b4d21a32299d612"
    },
    {
      "kind": "source",
      "path": "docs/governance/adoption-inventory.v1.json",
      "mode": "100644",
      "sha256": "05457aec87cd82d4cf705f0a5c5655dff31350b00844a30cfdd5cf8c76a954bc"
    },
    {
      "kind": "source",
      "path": "docs/governance/dependency-decisions.v1.json",
      "mode": "100644",
      "sha256": "b304de100258081b349c3435deb9fe329a8200548f949203a700fbc5a010b63c"
    },
    {
      "kind": "schema",
      "path": "docs/governance/evidence-v1.schema.json",
      "mode": "100644",
      "sha256": "286ee468e5e4903e0115381edbdd39c458ccbf717d4bbfb23eb21d764b1884d5"
    },
    {
      "kind": "source",
      "path": "rust-tron/Cargo.lock",
      "mode": "100644",
      "sha256": "c8bf1395110ba03bc8fcb0e0f2d89dfc87d9c3f47b75a085662e2cb068723db4"
    },
    {
      "kind": "source",
      "path": "rust-tron/Cargo.toml",
      "mode": "100644",
      "sha256": "8691685741ed539c44def10375169ee0a94329677ae5c61e373540993b1491f6"
    },
    {
      "kind": "generator",
      "path": "tools/platform/c000_artifacts.py",
      "mode": "100755",
      "sha256": "e2c3d877c1c73f166befbe78cea8a6361339b3788f8e1af792c9c2a0af3cef21"
    },
    {
      "kind": "generator",
      "path": "tools/platform/run",
      "mode": "100755",
      "sha256": "8ac6a65cfcd1be677cd47292d1e02325a3b45c035ec3bdbc2d0dc1545124e0d6"
    },
    {
      "kind": "source",
      "path": "tools/tracker/validate.py",
      "mode": "100755",
      "sha256": "4df090bc5dfb8c681047f6b22cf6860a30f3cca426731b23dc4915361c5375a1"
    }
  ],
  "review_bindings": [],
  "retention_until": "2027-08-29",
  "supersedes": null
}
