{
  "schema_version": 1,
  "evidence_id": "EV-0017",
  "owning_item": "C000.12",
  "subject_revision": "d346226f3f0b42cffa5f98b0abe6042311f01019",
  "subject_artifacts": [
    {
      "path": "docs/architecture/DR-004-custom-actuator-extensions.md",
      "mode": "100644",
      "sha256": "26a20a37a3843d6bcaf6dbf85dea34309a8e2c8db98e1f8c0038ac090c561483"
    },
    {
      "path": "docs/governance/evidence-v1.schema.json",
      "mode": "100644",
      "sha256": "286ee468e5e4903e0115381edbdd39c458ccbf717d4bbfb23eb21d764b1884d5"
    },
    {
      "path": "tools/platform/c000_artifacts.py",
      "mode": "100755",
      "sha256": "54b1d4edac59b67964350ebde7ba12f07b40a4eadd7b78ce62aeec5a091419ab"
    },
    {
      "path": "tools/platform/run",
      "mode": "100755",
      "sha256": "8ac6a65cfcd1be677cd47292d1e02325a3b45c035ec3bdbc2d0dc1545124e0d6"
    },
    {
      "path": "tools/tracker/validate.py",
      "mode": "100755",
      "sha256": "f7e871e189fedae9f71e470311ae36e4ec091625cb51d2fd65ff25b32312f35a"
    }
  ],
  "command": [
    "tools/platform/run",
    "c000-artifacts"
  ],
  "environment": {
    "tree_state": "clean",
    "toolchains": {
      "python": "Python 3.12.3",
      "git": "git version 2.43.0"
    },
    "platform_row": "P-LINUX-X64",
    "target": "x86_64-unknown-linux-gnu",
    "host_os": "linux",
    "host_architecture": "x86_64",
    "execution": "native",
    "working_directory": ".",
    "cells": [],
    "backend": "B-RUST-DEFAULT",
    "features": []
  },
  "run_id": "c000-descendant-20260829-152801Z-0017",
  "cases": [
    {
      "expected": {
        "artifacts_present": true,
        "documents_parse": true,
        "semantic_contracts_current": true
      },
      "id": "C000.12",
      "observed": {
        "artifact_count": 1,
        "issues": []
      },
      "outcome": "pass",
      "skip_disposition": null
    }
  ],
  "started_at": "2026-08-29T15:28:01Z",
  "ended_at": "2026-08-29T15:28:01Z",
  "observed_exit_code": 0,
  "observed_status": "pass",
  "expected": {
    "cases": [
      "C000.12"
    ],
    "artifacts_present": true,
    "documents_parse": true,
    "semantic_contracts_current": true
  },
  "observed": {
    "case_outcomes": {
      "C000.12": "pass"
    },
    "issues": []
  },
  "stdout": {
    "path": "docs/governance/evidence/EV-0017.stdout.txt",
    "sha256": "23f41e63843fb9588f903d1d5f95c375387249fd12d9a3fe923001a0e4448291"
  },
  "stderr": {
    "path": "docs/governance/evidence/EV-0017.stderr.txt",
    "sha256": "e3b0c44298fc1c149afbf4c8996fb92427ae41e4649b934ca495991b7852b855"
  },
  "artifacts": [],
  "invalidation_edges": [
    {
      "kind": "source",
      "path": "docs/architecture/DR-004-custom-actuator-extensions.md",
      "mode": "100644",
      "sha256": "26a20a37a3843d6bcaf6dbf85dea34309a8e2c8db98e1f8c0038ac090c561483"
    },
    {
      "kind": "schema",
      "path": "docs/governance/evidence-v1.schema.json",
      "mode": "100644",
      "sha256": "286ee468e5e4903e0115381edbdd39c458ccbf717d4bbfb23eb21d764b1884d5"
    },
    {
      "kind": "generator",
      "path": "tools/platform/c000_artifacts.py",
      "mode": "100755",
      "sha256": "54b1d4edac59b67964350ebde7ba12f07b40a4eadd7b78ce62aeec5a091419ab"
    },
    {
      "kind": "generator",
      "path": "tools/platform/run",
      "mode": "100755",
      "sha256": "8ac6a65cfcd1be677cd47292d1e02325a3b45c035ec3bdbc2d0dc1545124e0d6"
    },
    {
      "kind": "source",
      "path": "tools/tracker/validate.py",
      "mode": "100755",
      "sha256": "f7e871e189fedae9f71e470311ae36e4ec091625cb51d2fd65ff25b32312f35a"
    }
  ],
  "review_bindings": [],
  "retention_until": "2027-08-29",
  "supersedes": null
}
