{
  "schema_version": 1,
  "evidence_id": "EV-0005",
  "owning_item": "C000.14",
  "subject_revision": "0ff60fa23e4fafaccd91cdccbeaf997d498e8f8a",
  "subject_artifacts": [
    {
      "path": "docs/architecture/license-provenance-policy.md",
      "mode": "100644",
      "sha256": "b2f38df36dea372968f9a7445081e6a8f21ebaa694d142aed2186d5eb5d92c2a"
    },
    {
      "path": "docs/architecture/security-threat-policy.md",
      "mode": "100644",
      "sha256": "a9aa1144d40b789f5bdecf7afa0c8aca2953982f31a8a580d17c3f0724e9fa88"
    },
    {
      "path": "docs/governance/evidence-v1.schema.json",
      "mode": "100644",
      "sha256": "286ee468e5e4903e0115381edbdd39c458ccbf717d4bbfb23eb21d764b1884d5"
    },
    {
      "path": "tools/platform/c000_not_applicable.py",
      "mode": "100755",
      "sha256": "3c92d837c12d41a543a49a7e23cbd887361e4fa00d5154fc927d5a801117d3bd"
    }
  ],
  "command": [
    "python3",
    "tools/platform/c000_not_applicable.py"
  ],
  "environment": {
    "tree_state": "clean",
    "toolchains": {
      "python": "Python 3.12.3",
      "git": "git version 2.43.0"
    },
    "platform_row": "P-LINUX-X64",
    "target": "x86_64-unknown-linux-gnu",
    "host_os": "linux",
    "host_architecture": "x86_64",
    "execution": "native",
    "working_directory": ".",
    "cells": [
      "ffi",
      "packaging"
    ],
    "backend": "B-RUST-DEFAULT",
    "features": []
  },
  "run_id": "c000-descendant-20260829-162606Z-0ff60fa2-0005",
  "cases": [
    {
      "id": "ffi",
      "outcome": "pass",
      "expected": {
        "disposition": "not_applicable",
        "reviewed": true
      },
      "observed": {
        "disposition": "not_applicable",
        "reason": "C000 introduces no foreign-function boundary, linked native library, generated binding, or cross-language in-process call",
        "reopen_condition": "any FFI declaration, generated binding, native link, or in-process foreign call is introduced",
        "review_bindings": []
      },
      "skip_disposition": null
    },
    {
      "id": "packaging",
      "outcome": "pass",
      "expected": {
        "disposition": "not_applicable",
        "reviewed": true
      },
      "observed": {
        "disposition": "not_applicable",
        "reason": "C000 defines architecture governance and behavior-neutral verification tooling but no distributable binary, archive, image, installer, or release artifact",
        "reopen_condition": "a C000-produced distributable or release artifact is introduced",
        "review_bindings": []
      },
      "skip_disposition": null
    }
  ],
  "started_at": "2026-08-29T16:26:19Z",
  "ended_at": "2026-08-29T16:26:19Z",
  "observed_exit_code": 0,
  "observed_status": "pass",
  "expected": {
    "dispositions": [
      "not_applicable"
    ]
  },
  "observed": {
    "pending_independent_review": [
      "ffi",
      "packaging"
    ],
    "command_exit_code": 0
  },
  "stdout": {
    "path": "docs/governance/evidence/EV-0005.20260829-162606Z-0ff60fa2-0005.stdout.txt",
    "sha256": "749f8161ccfbcbe8fb8d4857e90cfb230a05bc998445932330e54fdc19854684"
  },
  "stderr": {
    "path": "docs/governance/evidence/EV-0005.20260829-162606Z-0ff60fa2-0005.stderr.txt",
    "sha256": "e3b0c44298fc1c149afbf4c8996fb92427ae41e4649b934ca495991b7852b855"
  },
  "artifacts": [],
  "invalidation_edges": [
    {
      "kind": "source",
      "path": "docs/architecture/license-provenance-policy.md",
      "mode": "100644",
      "sha256": "b2f38df36dea372968f9a7445081e6a8f21ebaa694d142aed2186d5eb5d92c2a"
    },
    {
      "kind": "source",
      "path": "docs/architecture/security-threat-policy.md",
      "mode": "100644",
      "sha256": "a9aa1144d40b789f5bdecf7afa0c8aca2953982f31a8a580d17c3f0724e9fa88"
    },
    {
      "kind": "schema",
      "path": "docs/governance/evidence-v1.schema.json",
      "mode": "100644",
      "sha256": "286ee468e5e4903e0115381edbdd39c458ccbf717d4bbfb23eb21d764b1884d5"
    },
    {
      "kind": "source",
      "path": "tools/platform/c000_not_applicable.py",
      "mode": "100755",
      "sha256": "3c92d837c12d41a543a49a7e23cbd887361e4fa00d5154fc927d5a801117d3bd"
    }
  ],
  "review_bindings": [],
  "retention_until": "2027-08-29",
  "supersedes": null
}
