{
  "schema_version": 1,
  "evidence_id": "EV-0009",
  "owning_item": "C000.04",
  "subject_revision": "f1bd213363055e86fac72b09eaa745e79acfa6f9",
  "subject_artifacts": [
    {
      "path": "docs/governance/evidence-v1.schema.json",
      "mode": "100644",
      "sha256": "286ee468e5e4903e0115381edbdd39c458ccbf717d4bbfb23eb21d764b1884d5"
    },
    {
      "path": "docs/oracles/normalization-policy-v1.json",
      "mode": "100644",
      "sha256": "ae8e332d42efa831f84130e37a0700b9204bd707bb6023609e21985179d8e897"
    },
    {
      "path": "docs/oracles/schemas/mismatch-report-v1.schema.json",
      "mode": "100644",
      "sha256": "40eecf6cc9977302331f54b7cb52570de78c6c702cb23b829f31006cf3579e00"
    },
    {
      "path": "docs/oracles/schemas/oracle-fixture-v1.schema.json",
      "mode": "100644",
      "sha256": "9e1c053e18b3c35ef8aa65eb974fa6cd869f66e12538138953994c6326e0f482"
    },
    {
      "path": "docs/oracles/schemas/oracle-result-v1.schema.json",
      "mode": "100644",
      "sha256": "f21a19efff4fb8749bae8b8eb2773e169f67c34788aff95654e72277d24725a4"
    },
    {
      "path": "tools/platform/c000_artifacts.py",
      "mode": "100755",
      "sha256": "7b3a5955ef6eabc07f647743265593b20eb7d5266a569a433975ff60a9ac3185"
    },
    {
      "path": "tools/platform/run",
      "mode": "100755",
      "sha256": "cba9a834f81c60c91fe36aeaa51046424103dafc5c14e1990af90e285b834770"
    },
    {
      "path": "tools/tracker/validate.py",
      "mode": "100755",
      "sha256": "a6dc7c963af5b707e2127d827bb2e7313190b8aff9491489f82a2f0a2fa7b712"
    }
  ],
  "command": [
    "tools/platform/run",
    "c000-artifacts"
  ],
  "environment": {
    "tree_state": "clean",
    "toolchains": {
      "python": "Python 3.12.3",
      "git": "git version 2.43.0"
    },
    "platform_row": "P-LINUX-X64",
    "target": "x86_64-unknown-linux-gnu",
    "host_os": "linux",
    "host_architecture": "x86_64",
    "execution": "native",
    "working_directory": ".",
    "cells": [],
    "backend": "B-RUST-DEFAULT",
    "features": []
  },
  "run_id": "c000-descendant-20260829-150506Z-0009",
  "cases": [
    {
      "id": "C000.04",
      "outcome": "pass",
      "expected": {
        "artifacts_present": true,
        "documents_parse": true,
        "semantic_contracts_current": true
      },
      "observed": {
        "artifact_count": 5,
        "issues": []
      },
      "skip_disposition": null
    }
  ],
  "started_at": "2026-08-29T15:05:06Z",
  "ended_at": "2026-08-29T15:05:06Z",
  "observed_exit_code": 0,
  "observed_status": "pass",
  "expected": {
    "artifacts_present": true,
    "documents_parse": true,
    "semantic_contracts_current": true
  },
  "observed": {
    "artifact_count": 5,
    "issues": []
  },
  "stdout": {
    "path": "docs/governance/evidence/EV-0009.stdout.txt",
    "sha256": "802a61c303d2422eea87cf42b97a8c1ca64757fd4ddb4dde445548cdafcb8f54"
  },
  "stderr": {
    "path": "docs/governance/evidence/EV-0009.stderr.txt",
    "sha256": "e3b0c44298fc1c149afbf4c8996fb92427ae41e4649b934ca495991b7852b855"
  },
  "artifacts": [
    {
      "path": "docs/oracles/normalization-policy-v1.json",
      "sha256": "ae8e332d42efa831f84130e37a0700b9204bd707bb6023609e21985179d8e897"
    },
    {
      "path": "docs/oracles/schemas/mismatch-report-v1.schema.json",
      "sha256": "40eecf6cc9977302331f54b7cb52570de78c6c702cb23b829f31006cf3579e00"
    },
    {
      "path": "docs/oracles/schemas/oracle-fixture-v1.schema.json",
      "sha256": "9e1c053e18b3c35ef8aa65eb974fa6cd869f66e12538138953994c6326e0f482"
    },
    {
      "path": "docs/oracles/schemas/oracle-result-v1.schema.json",
      "sha256": "f21a19efff4fb8749bae8b8eb2773e169f67c34788aff95654e72277d24725a4"
    }
  ],
  "invalidation_edges": [
    {
      "kind": "schema",
      "path": "docs/governance/evidence-v1.schema.json",
      "mode": "100644",
      "sha256": "286ee468e5e4903e0115381edbdd39c458ccbf717d4bbfb23eb21d764b1884d5"
    },
    {
      "kind": "source",
      "path": "docs/oracles/normalization-policy-v1.json",
      "mode": "100644",
      "sha256": "ae8e332d42efa831f84130e37a0700b9204bd707bb6023609e21985179d8e897"
    },
    {
      "kind": "source",
      "path": "docs/oracles/schemas/mismatch-report-v1.schema.json",
      "mode": "100644",
      "sha256": "40eecf6cc9977302331f54b7cb52570de78c6c702cb23b829f31006cf3579e00"
    },
    {
      "kind": "source",
      "path": "docs/oracles/schemas/oracle-fixture-v1.schema.json",
      "mode": "100644",
      "sha256": "9e1c053e18b3c35ef8aa65eb974fa6cd869f66e12538138953994c6326e0f482"
    },
    {
      "kind": "source",
      "path": "docs/oracles/schemas/oracle-result-v1.schema.json",
      "mode": "100644",
      "sha256": "f21a19efff4fb8749bae8b8eb2773e169f67c34788aff95654e72277d24725a4"
    },
    {
      "kind": "generator",
      "path": "tools/platform/c000_artifacts.py",
      "mode": "100755",
      "sha256": "7b3a5955ef6eabc07f647743265593b20eb7d5266a569a433975ff60a9ac3185"
    },
    {
      "kind": "generator",
      "path": "tools/platform/run",
      "mode": "100755",
      "sha256": "cba9a834f81c60c91fe36aeaa51046424103dafc5c14e1990af90e285b834770"
    },
    {
      "kind": "source",
      "path": "tools/tracker/validate.py",
      "mode": "100755",
      "sha256": "a6dc7c963af5b707e2127d827bb2e7313190b8aff9491489f82a2f0a2fa7b712"
    }
  ],
  "review_bindings": [],
  "retention_until": "2027-08-29",
  "supersedes": null
}
