{
  "schema_version": 1,
  "evidence_id": "EV-0012",
  "owning_item": "C000.07",
  "subject_revision": "bc0a489f6f982f64d90dd05a38109944879c2e26",
  "subject_artifacts": [
    {
      "path": "docs/architecture/license-provenance-policy.md",
      "mode": "100644",
      "sha256": "b2f38df36dea372968f9a7445081e6a8f21ebaa694d142aed2186d5eb5d92c2a"
    },
    {
      "path": "docs/architecture/security-threat-policy.md",
      "mode": "100644",
      "sha256": "a9aa1144d40b789f5bdecf7afa0c8aca2953982f31a8a580d17c3f0724e9fa88"
    },
    {
      "path": "docs/governance/evidence-v1.schema.json",
      "mode": "100644",
      "sha256": "286ee468e5e4903e0115381edbdd39c458ccbf717d4bbfb23eb21d764b1884d5"
    },
    {
      "path": "docs/oracles/schemas/license-provenance-v1.schema.json",
      "mode": "100644",
      "sha256": "16ae136443e483ee1165b93d2c9095e56a3f8463ae8c526543d294291db784ae"
    },
    {
      "path": "docs/oracles/schemas/security-finding-v1.schema.json",
      "mode": "100644",
      "sha256": "5bf75afc41b389d3dfa4c74880eb46db624dbb2a09d9eecb098dacad3190b52c"
    },
    {
      "path": "docs/oracles/schemas/threat-model-v1.schema.json",
      "mode": "100644",
      "sha256": "9f9153bd9bb8d6272107b06c3d520275b2dd48b49c9176bf41320ace79913741"
    },
    {
      "path": "tools/platform/c000_artifacts.py",
      "mode": "100755",
      "sha256": "54b1d4edac59b67964350ebde7ba12f07b40a4eadd7b78ce62aeec5a091419ab"
    },
    {
      "path": "tools/platform/run",
      "mode": "100755",
      "sha256": "8ac6a65cfcd1be677cd47292d1e02325a3b45c035ec3bdbc2d0dc1545124e0d6"
    },
    {
      "path": "tools/tracker/validate.py",
      "mode": "100755",
      "sha256": "b66248102e7cf3202a27c06e1fcd564b67f6b8f95f93ac91325e820a8aceca94"
    }
  ],
  "command": [
    "tools/platform/run",
    "c000-artifacts"
  ],
  "environment": {
    "tree_state": "clean",
    "toolchains": {
      "python": "Python 3.12.3",
      "git": "git version 2.43.0"
    },
    "platform_row": "P-LINUX-X64",
    "target": "x86_64-unknown-linux-gnu",
    "host_os": "linux",
    "host_architecture": "x86_64",
    "execution": "native",
    "working_directory": ".",
    "cells": [],
    "backend": "B-RUST-DEFAULT",
    "features": []
  },
  "run_id": "c000-descendant-20260829-154017Z-0012",
  "cases": [
    {
      "id": "C000.07",
      "outcome": "pass",
      "expected": {
        "artifacts_present": true,
        "documents_parse": true,
        "semantic_contracts_current": true
      },
      "observed": {
        "artifact_count": 5,
        "issues": []
      },
      "skip_disposition": null
    }
  ],
  "started_at": "2026-08-29T15:40:17Z",
  "ended_at": "2026-08-29T15:40:17Z",
  "observed_exit_code": 0,
  "observed_status": "pass",
  "expected": {
    "selected_cases": [
      "C000.07"
    ],
    "outcome": "pass"
  },
  "observed": {
    "selected_cases": [
      "C000.07"
    ],
    "audit_outcome": "fail",
    "case_outcomes": {
      "C000.07": "pass"
    }
  },
  "stdout": {
    "path": "docs/governance/evidence/EV-0012.20260829-154017Z.stdout.txt",
    "sha256": "82a4aad5afecc8935a1230c6dc2a6fc8c4797fef8aaa77e8e4d779c2aabedc86"
  },
  "stderr": {
    "path": "docs/governance/evidence/EV-0012.20260829-154017Z.stderr.txt",
    "sha256": "e3b0c44298fc1c149afbf4c8996fb92427ae41e4649b934ca495991b7852b855"
  },
  "artifacts": [],
  "invalidation_edges": [
    {
      "kind": "source",
      "path": "docs/architecture/license-provenance-policy.md",
      "mode": "100644",
      "sha256": "b2f38df36dea372968f9a7445081e6a8f21ebaa694d142aed2186d5eb5d92c2a"
    },
    {
      "kind": "source",
      "path": "docs/architecture/security-threat-policy.md",
      "mode": "100644",
      "sha256": "a9aa1144d40b789f5bdecf7afa0c8aca2953982f31a8a580d17c3f0724e9fa88"
    },
    {
      "kind": "schema",
      "path": "docs/governance/evidence-v1.schema.json",
      "mode": "100644",
      "sha256": "286ee468e5e4903e0115381edbdd39c458ccbf717d4bbfb23eb21d764b1884d5"
    },
    {
      "kind": "source",
      "path": "docs/oracles/schemas/license-provenance-v1.schema.json",
      "mode": "100644",
      "sha256": "16ae136443e483ee1165b93d2c9095e56a3f8463ae8c526543d294291db784ae"
    },
    {
      "kind": "source",
      "path": "docs/oracles/schemas/security-finding-v1.schema.json",
      "mode": "100644",
      "sha256": "5bf75afc41b389d3dfa4c74880eb46db624dbb2a09d9eecb098dacad3190b52c"
    },
    {
      "kind": "source",
      "path": "docs/oracles/schemas/threat-model-v1.schema.json",
      "mode": "100644",
      "sha256": "9f9153bd9bb8d6272107b06c3d520275b2dd48b49c9176bf41320ace79913741"
    },
    {
      "kind": "generator",
      "path": "tools/platform/c000_artifacts.py",
      "mode": "100755",
      "sha256": "54b1d4edac59b67964350ebde7ba12f07b40a4eadd7b78ce62aeec5a091419ab"
    },
    {
      "kind": "generator",
      "path": "tools/platform/run",
      "mode": "100755",
      "sha256": "8ac6a65cfcd1be677cd47292d1e02325a3b45c035ec3bdbc2d0dc1545124e0d6"
    },
    {
      "kind": "source",
      "path": "tools/tracker/validate.py",
      "mode": "100755",
      "sha256": "b66248102e7cf3202a27c06e1fcd564b67f6b8f95f93ac91325e820a8aceca94"
    }
  ],
  "review_bindings": [],
  "retention_until": "2027-08-29",
  "supersedes": null
}
