{
  "schema_version": 1,
  "evidence_id": "EV-0007",
  "owning_item": "C000.14",
  "subject_revision": "0ff60fa23e4fafaccd91cdccbeaf997d498e8f8a",
  "subject_artifacts": [
    {
      "path": "docs/governance/evidence-v1.schema.json",
      "mode": "100644",
      "sha256": "286ee468e5e4903e0115381edbdd39c458ccbf717d4bbfb23eb21d764b1884d5"
    },
    {
      "path": "tools/platform/c000_smoke.py",
      "mode": "100755",
      "sha256": "1aa4187be305525261e57aff460eeb9e7e721b659086f5b7c5e93e3fc7afb25c"
    },
    {
      "path": "tools/reference-runner/java-runner",
      "mode": "100755",
      "sha256": "deed7ed1b637cb82dc380c9da5eb56611ee8b8e8d172a74e592ca336a6298906"
    },
    {
      "path": "tools/reference-runner/rust-runner",
      "mode": "100755",
      "sha256": "360ed657851ac05f7609da5fa6e0bf78a283086789b4f1eb71c487ab41a870b9"
    },
    {
      "path": "tools/platform/run",
      "mode": "100755",
      "sha256": "8ac6a65cfcd1be677cd47292d1e02325a3b45c035ec3bdbc2d0dc1545124e0d6"
    },
    {
      "path": "docs/oracles/fixtures/v1/positive.json",
      "mode": "100644",
      "sha256": "aa32a0a57c7c17885a6aac20809d14f961be15fd2e350e0d42f0d4d431ce68d6"
    }
  ],
  "command": [
    "python3",
    "tools/platform/c000_smoke.py"
  ],
  "environment": {
    "tree_state": "clean",
    "toolchains": {
      "python": "Python 3.12.3",
      "git": "git version 2.43.0"
    },
    "platform_row": "P-LINUX-X64",
    "target": "x86_64-unknown-linux-gnu",
    "host_os": "linux",
    "host_architecture": "x86_64",
    "execution": "native",
    "working_directory": ".",
    "cells": [
      "smoke"
    ],
    "backend": "B-RUST-DEFAULT",
    "features": []
  },
  "run_id": "c000-descendant-20260829-162606Z-0ff60fa2-0007",
  "cases": [
    {
      "id": "java-file",
      "outcome": "pass",
      "expected": {
        "outcome": "pass"
      },
      "observed": {
        "exit_code": 0
      },
      "skip_disposition": null
    },
    {
      "id": "rust-stdin",
      "outcome": "pass",
      "expected": {
        "outcome": "pass"
      },
      "observed": {
        "exit_code": 0
      },
      "skip_disposition": null
    },
    {
      "id": "invalid-invocation",
      "outcome": "pass",
      "expected": {
        "outcome": "pass"
      },
      "observed": {
        "exit_code": 64
      },
      "skip_disposition": null
    },
    {
      "id": "platform-invalid",
      "outcome": "pass",
      "expected": {
        "outcome": "pass"
      },
      "observed": {
        "exit_code": 64
      },
      "skip_disposition": null
    },
    {
      "id": "private-temp-cleanup",
      "outcome": "pass",
      "expected": {
        "outcome": "pass"
      },
      "observed": {},
      "skip_disposition": null
    }
  ],
  "started_at": "2026-08-29T16:26:18Z",
  "ended_at": "2026-08-29T16:26:19Z",
  "observed_exit_code": 0,
  "observed_status": "pass",
  "expected": {
    "exit_code": 0
  },
  "observed": {
    "exit_code": 0
  },
  "stdout": {
    "path": "docs/governance/evidence/EV-0007.20260829-162606Z-0ff60fa2-0007.stdout.txt",
    "sha256": "355516fcf3ae90b40eb1db7dce8f91c0c0139d9ef3ced1c8cb9d639d6fe05dbf"
  },
  "stderr": {
    "path": "docs/governance/evidence/EV-0007.20260829-162606Z-0ff60fa2-0007.stderr.txt",
    "sha256": "e3b0c44298fc1c149afbf4c8996fb92427ae41e4649b934ca495991b7852b855"
  },
  "artifacts": [],
  "invalidation_edges": [
    {
      "kind": "source",
      "path": "docs/governance/evidence-v1.schema.json",
      "mode": "100644",
      "sha256": "286ee468e5e4903e0115381edbdd39c458ccbf717d4bbfb23eb21d764b1884d5"
    },
    {
      "kind": "source",
      "path": "tools/platform/c000_smoke.py",
      "mode": "100755",
      "sha256": "1aa4187be305525261e57aff460eeb9e7e721b659086f5b7c5e93e3fc7afb25c"
    },
    {
      "kind": "source",
      "path": "tools/reference-runner/java-runner",
      "mode": "100755",
      "sha256": "deed7ed1b637cb82dc380c9da5eb56611ee8b8e8d172a74e592ca336a6298906"
    },
    {
      "kind": "source",
      "path": "tools/reference-runner/rust-runner",
      "mode": "100755",
      "sha256": "360ed657851ac05f7609da5fa6e0bf78a283086789b4f1eb71c487ab41a870b9"
    },
    {
      "kind": "source",
      "path": "tools/platform/run",
      "mode": "100755",
      "sha256": "8ac6a65cfcd1be677cd47292d1e02325a3b45c035ec3bdbc2d0dc1545124e0d6"
    },
    {
      "kind": "source",
      "path": "docs/oracles/fixtures/v1/positive.json",
      "mode": "100644",
      "sha256": "aa32a0a57c7c17885a6aac20809d14f961be15fd2e350e0d42f0d4d431ce68d6"
    }
  ],
  "review_bindings": [],
  "retention_until": "2027-08-29",
  "supersedes": null
}
